<xs:schema xmlns:xs="http://www.w3.org/2001/XMLSchema">
    <xs:element name="personal">
        <xs:complexType>
            <xs:sequence>
                <xs:element name="persona" maxOccurs="unbounded">
                    <xs:complexType>
                        <xs:sequence>
                            <xs:element name="dades">
                                <xs:complexType>
                                    <xs:sequence>
                                        <xs:element name="nom" maxOccurs="3" type="xs:string"></xs:element>
                                        <xs:element name="cognoms">
                                            <xs:complexType>
                                                <xs:sequence>
                                                    <xs:element name="primer"></xs:element>
                                                    <xs:element name="segon" minOccurs="0"></xs:element>
                                                </xs:sequence>
                                                <xs:attribute name="complet">
                                                    <xs:simpleType>
                                                        <xs:restriction base="xs:string">
                                                            <xs:enumeration value="si"></xs:enumeration>
                                                            <xs:enumeration value="no"></xs:enumeration>
                                                        </xs:restriction>
                                                    </xs:simpleType>
                                                </xs:attribute>
                                                
                                            </xs:complexType>
                                        </xs:element>
                                         <xs:element name="dni" type="xs:string"></xs:element>
                                    </xs:sequence>
                                    <xs:attribute name="tipus" type="xs:string"></xs:attribute>
                                </xs:complexType>
                            </xs:element>
                           
                            <xs:element name="direccio">
                                <xs:complexType>
                                    <xs:simpleContent>
                                        <xs:extension base="xs:string">
                                            <xs:attribute name="tipus" type="xs:string"></xs:attribute>
                                        </xs:extension>
                                    </xs:simpleContent>
                                </xs:complexType>
                            </xs:element>
                            <xs:element name="comentari" type="xs:string" minOccurs="0"></xs:element>
                        </xs:sequence>
                        <xs:attribute name="id" type="xs:string" use="required"></xs:attribute>
                    </xs:complexType>
                </xs:element>
            </xs:sequence>
        </xs:complexType>
    </xs:element>
</xs:schema>